74050,55,MAURÍCIO QUINTELLA MALTA LESSA,MAURÍCIO QUINTELLA LESSA,Servidor Público,Licenciado,M,AL,PR
73588,55,CARLOS MAURO CABRAL BENEVIDES,MAURO BENEVIDES,"Advogado, Jornalista, Professor",Suplência,M,CE,MDB
178827,55,MAX FREITAS MAURO FILHO,MAX FILHO,Servidor Público,Vacância,M,ES,PSDB
188097,55,MERLONG SOLANO NOGUEIRA,MERLONG SOLANO,Professor,Suplência,M,PI,PT
141509,55,MIGUEL CORRÊA DA SILVA JÚNIOR,MIGUEL CORRÊA,"Comunicador, Professor",Em Exercício,M,MG,PT
74457,55,MORONI BING TORGAN,MORONI TORGAN,Delegado,Vacância,M,CE,DEM
74751,55,NILMÁRIO DE MIRANDA,NILMÁRIO MIRANDA,Jornalista,Suplência,M,MG,PT
74159,55,ODAIR JOSÉ DA CUNHA,ODAIR CUNHA,Advogado,Em Exercício,M,MG,PT
74752,55,ODELMO LEÃO CARNEIRO SOBRINHO,ODELMO LEÃO,"Agropecuarista, Bancário",Vacância,M,MG,PP
73692,55,OSMAR GASPARINI TERRA,OSMAR TERRA,Médico,Em Exercício,M,RS,MDB
170673,55,SERGIO PAULO DE OLIVEIRA,PROFESSOR SÉRGIO DE OLIVEIRA,-,Suplência,M,PR,PSD
74048,55,RAUL BELENS JUNGMANN PINTO,RAUL JUNGMANN,Consultor,Suplência,M,PE,PPS
178925,55,REJANE RIBEIRO SOUSA DIAS,REJANE DIAS,Administrador,Em Exercício,F,PI,PT
73788,55,RICARDO JOSÉ MAGALHÃES BARROS,RICARDO BARROS,"Empresário, Engenheiro",Em Exercício,M,PR,PP
160652,55,ROBERTO SÉRGIO RIBEIRO COUTINHO TEIXEIRA,ROBERTO TEIXEIRA,Dentista,Suplência,M,PE,PP
88950,55,RODRIGO GARCIA,RODRIGO GARCIA,"Advogado, Empresário",Em Exercício,M,SP,DEM
163321,55,RONALDO NOGUEIRA DE OLIVEIRA,RONALDO NOGUEIRA,Administrador,Em Exercício,M,RS,PTB
191684,55,ROSANGELA APARECIDA DA SILVA BARROS,ROSÂNGELA CURADO,-,Suplência,F,MA,PDT
178935,55,VALDIR LUIZ ROSSONI,ROSSONI,Empresário,Em Exercício,M,PR,PSDB
178990,55,SAMUEL MOREIRA DA SILVA JUNIOR,SAMUEL MOREIRA,Engenheiro,Em Exercício,M,SP,PSDB
74372,55,JOÃO SANDES JÚNIOR,SANDES JÚNIOR,"Advogado, Comunicador",Em Exercício,M,GO,PP
74210,55,JOSÉ SARNEY FILHO,SARNEY FILHO,Advogado,Em Exercício,M,MA,PV
178921,55,SEBASTIAO IGNACIO DE OLIVEIRA JUNIOR,SEBASTIÃO OLIVEIRA,-,Em Exercício,M,PE,PR
160613,55,SEBASTIÃO SIBÁ MACHADO OLIVEIRA,SIBÁ MACHADO,Geógrafo,Em Exercício,M,AC,PT
74765,55,SILAS BRASILEIRO,SILAS BRASILEIRO,"Administrador, Agricultor, Empresário",Suplência,M,MG,MDB
73831,55,José Augusto da Silva Curvo,TAMPINHA,Médico,Suplência,M,MT,PSD
194340,55,AUDIVAL AMÉLIO DA SILVA NETO,VAL AMÉLIO,-,Suplência,M,AL,PRTB
137853,55,WADSON NATHANIEL RIBEIRO,WADSON RIBEIRO,-,Suplência,M,MG,PCdoB
160620,55,WASHINGTON REIS DE OLIVEIRA,WASHINGTON REIS,-,Vacância,M,RJ,MDB
141563,55,WILLIAM BOSS WOO,WILLIAM WOO,"Engenheiro, Policial",Suplência,M,SP,PP
74213,55,ANTONIO BALHMANN CARDOSO NUNES FILHO,ANTONIO BALHMANN,Engenheiro,Em Exercício,M,CE,PDT
190149,55,FABRICIO JOSÉ SATIRO DE OLIVEIRA,FABRICIO OLIVEIRA,-,Suplência,M,SC,PSB
73481,55,FERNANDO STEPHAN MARRONI,FERNANDO MARRONI,Servidor Público,Suplência,M,RS,PT
178996,55,GIOVANI BATISTA FELTES,GIOVANI FELTES,-,Em Exercício,M,RS,MDB
178899,55,MARCIO CAMPOS MONTEIRO,MARCIO MONTEIRO,Agropecuarista,Vacância,M,MS,S.PART.
80920,55,JOSÉ LUIZ DE FRANÇA PENNA,PENNA,"Ator, Músico, Músico, Músico",Suplência,M,SP,PV
